{
  "content_id": "33333333-3333-4333-8333-333333333333",
  "workspace_id": "22222222-2222-4222-8222-222222222222",
  "internal_title": "Autumn launch",
  "status": "draft",
  "current_revision_id": "44444444-4444-4444-8444-444444444444",
  "current_revision_number": 1,
  "created_by_user_id": "55555555-5555-4555-8555-555555555555",
  "created_at": "2026-08-21T10:00:00.000Z",
  "updated_at": "2026-08-21T10:00:00.000Z"
}
